{
  "algorithm": "sha256",
  "created_at": "2026-08-05T08:00:00+00:00",
  "files": [
    {
      "bytes": 3859,
      "digest": "sha256:eee6f9bf106fa9e8f82aff480300022040f202034b785aab4db01889638f77d1",
      "path": "analysis/buck-load-001.json"
    },
    {
      "bytes": 8690,
      "digest": "sha256:89914725d4f734d54b4a5835eab476ffb045b4a9c87e666237e6853c27704827",
      "path": "analysis/rc-baseline-001.json"
    },
    {
      "bytes": 8698,
      "digest": "sha256:cb51ed0a993c87eaa97e809d690080562c4f0e408f816c2bb92a18346d973b04",
      "path": "analysis/rc-swap-002.json"
    },
    {
      "bytes": 521,
      "digest": "sha256:85c4e49b1a225fdd518491e98be8886d212522d39495edc29a1baa119ac6254b",
      "path": "benchlineage.json"
    },
    {
      "bytes": 373,
      "digest": "sha256:59bf35001aba40f43b45900d8584324e883f2b13dd886f2f97eb03f95d4a35f5",
      "path": "calibrations/cal-dmm-01-2026.json"
    },
    {
      "bytes": 379,
      "digest": "sha256:3b2a0702e00ed0cbe1b9e949b7973268318ddd12d0dad0ffc033c38a9c15ee5d",
      "path": "calibrations/cal-scope-01-2026.json"
    },
    {
      "bytes": 382,
      "digest": "sha256:bf5028f10c74e0d80ed73363386644e55114f3e7ef39dbd68c15a93836b92bc6",
      "path": "calibrations/cal-source-01-2026.json"
    },
    {
      "bytes": 456,
      "digest": "sha256:94adcd45d83a1a836b64182f41270bb1a6e31e0121ade82084cc7780a9e070f1",
      "path": "data/raw/buck-load-sweep.csv"
    },
    {
      "bytes": 1693,
      "digest": "sha256:4266851a5cdaf4fd8cb30110c1a7de7ec19c3bc5ccd7e5b721973e7858e63a83",
      "path": "data/raw/rc-baseline.csv"
    },
    {
      "bytes": 1699,
      "digest": "sha256:17608ebc141b71dbb79bc954b4826f2746a9375b8f26d96e3d56cd7e479dd9cf",
      "path": "data/raw/rc-resistor-swap.csv"
    },
    {
      "bytes": 333,
      "digest": "sha256:a41557a2d2170db06b84170f695ac5cec77e9b9497ffb3d74f0efd7946ae40a5",
      "path": "instruments/dmm-01.json"
    },
    {
      "bytes": 332,
      "digest": "sha256:8337dfb996cfb8c1555dfc0823c101ce4e5039b0d77a336195dd425182cf980f",
      "path": "instruments/scope-01.json"
    },
    {
      "bytes": 350,
      "digest": "sha256:f796b33e5f4ddac03c133d3537b3e91f906a15661bcba42022912fa0b1be46f2",
      "path": "instruments/source-01.json"
    },
    {
      "bytes": 512,
      "digest": "sha256:567274a206471a9af68a2dc8efbb7fe245e88505c245208b7d9ac564219cb0c8",
      "path": "runs/buck-load-001.json"
    },
    {
      "bytes": 530,
      "digest": "sha256:d9736e4ab1d8894e6114b8bffbcf7fb67c0dddc2e18344be0047b689990c492b",
      "path": "runs/rc-baseline-001.json"
    },
    {
      "bytes": 592,
      "digest": "sha256:a4297bcc5502ce5a32a6b1aa52f01c0ac8b4e9ad34908a789f946eeec6d33230",
      "path": "runs/rc-swap-002.json"
    },
    {
      "bytes": 558,
      "digest": "sha256:7e411b8f6398da3f2104e44609b4434920155b5559fd9fb78b5c10b37306ef60",
      "path": "studies/buck-efficiency.json"
    },
    {
      "bytes": 591,
      "digest": "sha256:57dfb43bc61b148e0ba40efc70590530c0d68ba6ac6a223d61ec3e6aa4827d61",
      "path": "studies/rc-filter.json"
    }
  ],
  "label": "Public synthetic demonstration",
  "root_digest": "sha256:b40aa7fe02d3c7a98593018744f06d45cbb07cb6e7dae0fbc6418128938a5df6",
  "schema": "benchlineage/seal/v1",
  "scope": {
    "excluded": [
      "reports/**",
      "seals/**"
    ],
    "included": "all workspace files"
  }
}
